<?xml version="1.0" encoding="UTF-8"?>
<phpDatabaseAnalyzer xmlns:xsi="http://www.w3.org/2001/XMLSchema-instance" xsi:noNamespaceSchemaLocation="../libs/config.xsd">
	<outputType>XML</outputType>
	<loggingMode>full</loggingMode>
	<databaseTestSuite databaseEngine="MySQL">
		<connection>
			<host>localhost</host>
			<port>3306</port>
			<socket></socket>
			<username>root</username>
			<password></password>
			<database>Test</database>
		</connection>
	</databaseTestSuite>
</phpDatabaseAnalyzer>