<?xml version="1.0" encoding="UTF-8"?>
<phpDatabaseAnalyzer xmlns:xsi="http://www.w3.org/2001/XMLSchema-instance" xsi:noNamespaceSchemaLocation="../libs/config.xsd">
	<outputType>XML</outputType>
	<databaseTestSuite databaseEngine="MySQL">
		<connection>
			<host>localhost</host>
			<port>3306</port>
			<username>root</username>
			<password>9sasjka7a</password>
			<database>testDB1</database>
		</connection>
	</databaseTestSuite>
	<databaseTestSuite databaseEngine="MySQL">
		<connection>
			<host>conftec-testdb01</host>
			<port>3306</port>
			<username>admin</username>
			<password>2kkwsk27</password>
			<database>testDB2</database>
		</connection>
	</databaseTestSuite>
</phpDatabaseAnalyzer>